<?xml version="1.0" encoding="UTF-8"?>
<!DOCTYPE FSE SYSTEM "Echecs.dtd"> 
<FSE>
    <Tournoi>
      <NomTournoi>Tournoi dee juniors Suisse</NomTournoi>
      <Participant id="P1">
            <Nom>Turing</Nom>
            <Prenom>Alan</Prenom>
            <ELO>2700</ELO>
      </Participant>
      <Participant id="P2">
          <Nom>Lovelace</Nom>
          <Prenom>Adda</Prenom>
          <ELO>2600</ELO>
      </Participant>
        <Vainqueur id="P1"/>
        <Parties>
            <Partie score="1-0">
                <Date>
                    <Jour>07</Jour>
                    <Mois>06</Mois>
                    <Annee>2018</Annee>
                    <Heure>11</Heure>
                    <Minute>00</Minute>
                </Date>
                <Arbitre>
                    <Nom>Donald</Nom>
                    <Prenom>Knuth</Prenom>
                </Arbitre>
                <Blanc id="P1"/>
                <Noir id="P2"/>
                <Coups>
                   <Coup>
                        <Deplacement Piece="Pion">
                            <Destination>E4</Destination>
                        </Deplacement>
                   </Coup>
                   <Coup>
                        <Deplacement Piece="Pion">
                            <Destination>E5</Destination>
                        </Deplacement>
                   </Coup>
                   <Coup>
                        <Deplacement Piece="Fou">
                            <Destination>C4</Destination>
                        </Deplacement>
                   </Coup>
                   <Coup>
                        <Deplacement Piece="Cavalier">
                            <Destination>C6</Destination>
                        </Deplacement>
                   </Coup>
                   <Coup>
                        <Deplacement Piece="Dame">
                            <Destination>H5</Destination>
                        </Deplacement>
                   </Coup>
                   <Coup>
                        <Deplacement Piece="Cavalier">
                            <Destination>F6</Destination>
                        </Deplacement>
                   </Coup>
                   <Coup>
                        <Deplacement Piece="Dame"  Elimination="Pion" Situation="Ã‰chec et mat">
                            <Destination>F7</Destination>
                        </Deplacement>
                    </Coup>
                </Coups>
            </Partie>
        </Parties>
    </Tournoi>
</FSE>
